<!ELEMENT squad (name, email, web?, discord?, picture?, title?, member+)>
<!ATTLIST squad nick CDATA #REQUIRED>
<!ELEMENT member (name, email, remark?)>
<!ATTLIST member id CDATA #REQUIRED nick CDATA #REQUIRED>
<!ELEMENT name (#PCDATA)>
<!ELEMENT email (#PCDATA)>
<!ELEMENT web (#PCDATA)>
<!ELEMENT discord (#PCDATA)>
<!ELEMENT picture (#PCDATA)>
<!ELEMENT title (#PCDATA)>
<!ELEMENT remark (#PCDATA)>
